{
  "$schema": "https://json-schema.org/draft/2020-12/schema",
  "$id": "https://docs.oasis-open.org/ubl/2/json/schemas/UBL-ForwardingInstructions-2",
  "description": "A document issued to a forwarder, giving instructions regarding the action to be taken for the forwarding of goods described therein. Forwarding Instructions is used by any party who gives instructions for the transportation services required for a consignment of goods to any party who is contracted to provide the transportation services. The parties who issue this document are commonly referred to as the shipper or consignor, while the parties who receive this document are forwarders, carriers, shipping agents, etc. This document may also be issued by a forwarder or shipping agent in its capacity as a shipper. This document can be used to arrange for the transportation (1) of different types of goods or cargoes; (2) whether containerized or non-containerized; (3) through different modes of transport including multi-modal; and (4) from any origin to any destination.",
  "type": "object",
  "properties": {
    "UBLEntity": {
      "const": "https://docs.oasis-open.org/ubl/2/json/schemas/UBL-ForwardingInstructions-2",
      "description": "Identifies the JSON schema governing this instance."
    },
    "UBLExtensions": {
      "$ref": "https://docs.oasis-open.org/ubl/2/json/schemas/CommonExtensionComponents-2#/$defs/UBLExtensionsType"
    },
    "Signature": {
      "oneOf": [
        {
          "$ref": "https://docs.oasis-open.org/ubl/2/json/schemas/CommonAggregateComponents-2#/$defs/SignatureType"
        },
        {
          "type": "array",
          "items": {
            "$ref": "https://docs.oasis-open.org/ubl/2/json/schemas/CommonAggregateComponents-2#/$defs/SignatureType"
          },
          "minItems": 1
        }
      ]
    },
    "UBLVersionID": {
      "$ref": "https://docs.oasis-open.org/ubl/2/json/schemas/CommonBasicComponents-2#/$defs/UBLVersionID"
    },
    "CustomizationID": {
      "$ref": "https://docs.oasis-open.org/ubl/2/json/schemas/CommonBasicComponents-2#/$defs/CustomizationID"
    },
    "ProfileID": {
      "$ref": "https://docs.oasis-open.org/ubl/2/json/schemas/CommonBasicComponents-2#/$defs/ProfileID"
    },
    "ProfileExecutionID": {
      "$ref": "https://docs.oasis-open.org/ubl/2/json/schemas/CommonBasicComponents-2#/$defs/ProfileExecutionID"
    },
    "ID": {
      "$ref": "https://docs.oasis-open.org/ubl/2/json/schemas/CommonBasicComponents-2#/$defs/ID"
    },
    "CarrierAssignedID": {
      "$ref": "https://docs.oasis-open.org/ubl/2/json/schemas/CommonBasicComponents-2#/$defs/CarrierAssignedID"
    },
    "UUID": {
      "$ref": "https://docs.oasis-open.org/ubl/2/json/schemas/CommonBasicComponents-2#/$defs/UUID"
    },
    "IssueDate": {
      "$ref": "https://docs.oasis-open.org/ubl/2/json/schemas/CommonBasicComponents-2#/$defs/IssueDate"
    },
    "IssueTime": {
      "$ref": "https://docs.oasis-open.org/ubl/2/json/schemas/CommonBasicComponents-2#/$defs/IssueTime"
    },
    "Name": {
      "$ref": "https://docs.oasis-open.org/ubl/2/json/schemas/CommonBasicComponents-2#/$defs/Name"
    },
    "Description": {
      "oneOf": [
        {
          "$ref": "https://docs.oasis-open.org/ubl/2/json/schemas/CommonBasicComponents-2#/$defs/Description"
        },
        {
          "type": "array",
          "items": {
            "$ref": "https://docs.oasis-open.org/ubl/2/json/schemas/CommonBasicComponents-2#/$defs/Description"
          },
          "minItems": 1
        }
      ]
    },
    "Note": {
      "oneOf": [
        {
          "$ref": "https://docs.oasis-open.org/ubl/2/json/schemas/CommonBasicComponents-2#/$defs/Note"
        },
        {
          "type": "array",
          "items": {
            "$ref": "https://docs.oasis-open.org/ubl/2/json/schemas/CommonBasicComponents-2#/$defs/Note"
          },
          "minItems": 1
        }
      ]
    },
    "DocumentStatusCode": {
      "$ref": "https://docs.oasis-open.org/ubl/2/json/schemas/CommonBasicComponents-2#/$defs/DocumentStatusCode"
    },
    "ShippingOrderID": {
      "$ref": "https://docs.oasis-open.org/ubl/2/json/schemas/CommonBasicComponents-2#/$defs/ShippingOrderID"
    },
    "ToOrderIndicator": {
      "$ref": "https://docs.oasis-open.org/ubl/2/json/schemas/CommonBasicComponents-2#/$defs/ToOrderIndicator"
    },
    "AdValoremIndicator": {
      "$ref": "https://docs.oasis-open.org/ubl/2/json/schemas/CommonBasicComponents-2#/$defs/AdValoremIndicator"
    },
    "DeclaredCarriageValueAmount": {
      "$ref": "https://docs.oasis-open.org/ubl/2/json/schemas/CommonBasicComponents-2#/$defs/DeclaredCarriageValueAmount"
    },
    "OtherInstruction": {
      "oneOf": [
        {
          "$ref": "https://docs.oasis-open.org/ubl/2/json/schemas/CommonBasicComponents-2#/$defs/OtherInstruction"
        },
        {
          "type": "array",
          "items": {
            "$ref": "https://docs.oasis-open.org/ubl/2/json/schemas/CommonBasicComponents-2#/$defs/OtherInstruction"
          },
          "minItems": 1
        }
      ]
    },
    "ConsignorParty": {
      "$ref": "https://docs.oasis-open.org/ubl/2/json/schemas/CommonAggregateComponents-2#/$defs/PartyType"
    },
    "CarrierParty": {
      "$ref": "https://docs.oasis-open.org/ubl/2/json/schemas/CommonAggregateComponents-2#/$defs/PartyType"
    },
    "FreightForwarderParty": {
      "$ref": "https://docs.oasis-open.org/ubl/2/json/schemas/CommonAggregateComponents-2#/$defs/PartyType"
    },
    "Shipment": {
      "$ref": "https://docs.oasis-open.org/ubl/2/json/schemas/CommonAggregateComponents-2#/$defs/ShipmentType"
    },
    "DocumentReference": {
      "oneOf": [
        {
          "$ref": "https://docs.oasis-open.org/ubl/2/json/schemas/CommonAggregateComponents-2#/$defs/DocumentReferenceType"
        },
        {
          "type": "array",
          "items": {
            "$ref": "https://docs.oasis-open.org/ubl/2/json/schemas/CommonAggregateComponents-2#/$defs/DocumentReferenceType"
          },
          "minItems": 1
        }
      ]
    },
    "ExchangeRate": {
      "oneOf": [
        {
          "$ref": "https://docs.oasis-open.org/ubl/2/json/schemas/CommonAggregateComponents-2#/$defs/ExchangeRateType"
        },
        {
          "type": "array",
          "items": {
            "$ref": "https://docs.oasis-open.org/ubl/2/json/schemas/CommonAggregateComponents-2#/$defs/ExchangeRateType"
          },
          "minItems": 1
        }
      ]
    },
    "DocumentDistribution": {
      "oneOf": [
        {
          "$ref": "https://docs.oasis-open.org/ubl/2/json/schemas/CommonAggregateComponents-2#/$defs/DocumentDistributionType"
        },
        {
          "type": "array",
          "items": {
            "$ref": "https://docs.oasis-open.org/ubl/2/json/schemas/CommonAggregateComponents-2#/$defs/DocumentDistributionType"
          },
          "minItems": 1
        }
      ]
    }
  },
  "required": [
    "UBLEntity",
    "ID",
    "Shipment"
  ],
  "additionalProperties": false,
  "minProperties": 1,
  "title": "Forwarding Instructions. Details"
}
